{
  "$schema": "../../packages/conventions/schemas/draft-manifest.schema.json",
  "name": "Acme Marketing Site Refresh",
  "description": "Exploration of three hero treatments across two themes and two layouts for the Acme marketing site.",
  "axes": [
    {
      "name": "page",
      "description": "Top-level routes the site needs to ship.",
      "choices": [
        { "name": "landing" },
        { "name": "pricing" },
        { "name": "about" }
      ]
    },
    {
      "name": "variant",
      "description": "Hero treatment. Only meaningful on the landing page; non-landing pages use 'none'.",
      "choices": [
        { "name": "none", "description": "No hero variation; used for pages that don't have a hero." },
        { "name": "bold-hero", "description": "High-contrast oversized hero headline with a single CTA." },
        { "name": "story-hero", "description": "Editorial layout leading with customer narrative." },
        { "name": "product-hero", "description": "Hero anchored around a product screenshot." }
      ]
    },
    {
      "name": "theme",
      "choices": [
        { "name": "light", "description": "Default light palette." },
        { "name": "dark", "description": "Inverted palette with accent highlights." }
      ]
    },
    {
      "name": "layout",
      "choices": [
        { "name": "centered", "description": "Single-column centered layout." },
        { "name": "split", "description": "Two-column split with content left, media right." }
      ]
    }
  ],
  "pages": [
    { "coordinates": { "page": "landing", "variant": "bold-hero",    "theme": "light", "layout": "centered" }, "path": "pages/landing/bold-light-centered.html" },
    { "coordinates": { "page": "landing", "variant": "bold-hero",    "theme": "light", "layout": "split"    }, "path": "pages/landing/bold-light-split.html" },
    { "coordinates": { "page": "landing", "variant": "bold-hero",    "theme": "dark",  "layout": "centered" }, "path": "pages/landing/bold-dark-centered.html" },
    { "coordinates": { "page": "landing", "variant": "bold-hero",    "theme": "dark",  "layout": "split"    }, "path": "pages/landing/bold-dark-split.html" },
    { "coordinates": { "page": "landing", "variant": "story-hero",   "theme": "light", "layout": "centered" }, "path": "pages/landing/story-light-centered.html" },
    { "coordinates": { "page": "landing", "variant": "story-hero",   "theme": "dark",  "layout": "centered" }, "path": "pages/landing/story-dark-centered.html" },
    { "coordinates": { "page": "landing", "variant": "product-hero", "theme": "light", "layout": "split"    }, "path": "pages/landing/product-light-split.html" },
    { "coordinates": { "page": "landing", "variant": "product-hero", "theme": "dark",  "layout": "split"    }, "path": "pages/landing/product-dark-split.html" },
    { "coordinates": { "page": "pricing", "variant": "none",         "theme": "light", "layout": "centered" }, "path": "pages/pricing/light-centered.html" },
    { "coordinates": { "page": "pricing", "variant": "none",         "theme": "dark",  "layout": "centered" }, "path": "pages/pricing/dark-centered.html" },
    { "coordinates": { "page": "about",   "variant": "none",         "theme": "light", "layout": "centered" }, "path": "pages/about/light-centered.html" },
    { "coordinates": { "page": "about",   "variant": "none",         "theme": "dark",  "layout": "centered" }, "path": "pages/about/dark-centered.html" }
  ],
  "prompt": "references/brief.md",
  "source": {
    "sha": "1a2b3c4d5e6f7890abcdef1234567890abcdef12",
    "repo": "acme/marketing-site",
    "author": "design-bot"
  },
  "createdAt": "2026-04-20T15:04:05.000Z"
}
